dataset_identifier,data_repository,dataset_webpage,source_section,retrieval_pattern,access_mode,link,source_url,download_link,title,content_type,id,caption,description,context_description,file_extension,pub_title,file_info,section_class,a_attr_href,a_attr_class,a_attr_data-ga-action,a_attr_target,a_attr_rel
,,,supplementary material,.//supplementary-material,,NIHMS1523940-supplement-2.xlsx,https://pmc.ncbi.nlm.nih.gov/articles/PMC6646046,https://pmc.ncbi.nlm.nih.gov/articles/instance/6646046/bin/NIHMS1523940-supplement-2.xlsx,No Title,local-data,SD2,No description,2,"Specifically, we collected 278 gene sets relevant to CNS and behavior/neurological phenotypes from Mouse Genome Informatics (MGI) Mammalian Phenotype Ontology (MPO) database ( Methods [rid=S15] ) and observed significant enrichment of HRGs in 33 gene sets after Bonferroni correction ( Supplementary Table 4 [this file] ). 
In addition, we also observed that the 65 non-nearest HRGs are significantly enriched in 19 MPO gene sets ( Supplementary Table 5 [this file] ), while no significantly enriched gene sets were observed for the 65 nearest non-HRG genes ( Supplementary Table 6 [this file] ), providing strong and orthogonal support for iRIGS identified risk genes that are beyond the proximity to the GWAS index SNPs. 
We curated a list of 2263 confirmed druggable targets from multiple sources ( Methods [rid=S15] ), and found that 28 (27%) HRGs are targets of 198 FDA-approved, clinically investigational, or preclinical drugs ( Supplementary Fig. 9 [rid=SD1] and Supplementary Table 7 [this file] ).",xlsx,A Bayesian framework that integrates multi-omics data and gene networks predicts risk genes from schizophrenia GWAS data,,,,,,,
,,,supplementary material,.//supplementary-material,,NIHMS1523940-supplement-3.pdf,https://pmc.ncbi.nlm.nih.gov/articles/PMC6646046,https://pmc.ncbi.nlm.nih.gov/articles/instance/6646046/bin/NIHMS1523940-supplement-3.pdf,No Title,local-data,SD3,No description,3,"Details of iRIGS can be found in Methods [rid=S15] and Supplementary Note [this file] . 
We performed iRIGS on these loci to identify risk genes of SCZ ( Supplementary Table 1 [this file] ). 
We also tried other thresholds to define LBGs, and the enrichment patterns are similar ( Supplementary Table 2 [this file] ). 
We found that NRGs are indeed connected to more DREs in Hi-C and FANTOM5 data ( Fig. 2b [rid=F2] , Supplementary Fig. 1 [rid=SD1] , Methods [rid=S15] , and Supplementary Note [this file] ). 
We therefore integrated them into iRIGS ( Methods [rid=S15] ) and predicted 104 high-confident risk genes (HRGs) in total ( Supplementary Table 1 [this file] ). 
We found that non-nearest HRGs are more significantly enriched in the gene sets compared to nearest non-HRG genes ( Supplementary Table 3 [this file] ), suggesting that the 65 non-nearest HRGs identified by iRIGS are more likely to be true risk genes than their nearest counterparts. 
We highlighted these genes with extended supporting evidence and description in Supplementary Table 1 [this file] . 
The distance of or to in the network is calculated using the random walk with restart (RWR) algorithm ( Supplemental Note [this file] ). We employed the Mahalanobis transformation to de-correlate the integrated multi-dimensional data so that any supportive genomic features can be properly incorporated ( Supplementary Note [this file] ). 
We adopted the Jensen-Shannon divergence to measure the tissue-specificity of each gene in each tissue ( Supplementary Note [this file] ). 
All the data used in this study are from public resources that were specified in Methods [rid=S15] and Supplementary Note [this file] . 
See main text and Supplementary Note [this file] for details.",pdf,A Bayesian framework that integrates multi-omics data and gene networks predicts risk genes from schizophrenia GWAS data,,,,,,,
,,,supplementary material,.//supplementary-material,,NIHMS1523940-supplement-4.pdf,https://pmc.ncbi.nlm.nih.gov/articles/PMC6646046,https://pmc.ncbi.nlm.nih.gov/articles/instance/6646046/bin/NIHMS1523940-supplement-4.pdf,No Title,local-data,SD4,No description,4,,pdf,A Bayesian framework that integrates multi-omics data and gene networks predicts risk genes from schizophrenia GWAS data,,,,,,,
GSE135893,geo,https://www.ncbi.nlm.nih.gov/geo/query/acc.cgi?acc=GSE135893,data_availability,data availability,Complex download,,https://pmc.ncbi.nlm.nih.gov/articles/PMC10387117,,,,,,,,,Guided construction of single cell reference for human and mouse lung,,,,,,,
GSE136831,geo,https://www.ncbi.nlm.nih.gov/geo/query/acc.cgi?acc=GSE136831,data_availability,data availability,Complex download,,https://pmc.ncbi.nlm.nih.gov/articles/PMC10387117,,,,,,,,,Guided construction of single cell reference for human and mouse lung,,,,,,,
GSE122960,geo,https://www.ncbi.nlm.nih.gov/geo/query/acc.cgi?acc=GSE122960,data_availability,data availability,Complex download,,https://pmc.ncbi.nlm.nih.gov/articles/PMC10387117,,,,,,,,,Guided construction of single cell reference for human and mouse lung,,,,,,,
GSE134174,geo,https://www.ncbi.nlm.nih.gov/geo/query/acc.cgi?acc=GSE134174,data_availability,data availability,Complex download,,https://pmc.ncbi.nlm.nih.gov/articles/PMC10387117,,,,,,,,,Guided construction of single cell reference for human and mouse lung,,,,,,,
GSE161382,geo,https://www.ncbi.nlm.nih.gov/geo/query/acc.cgi?acc=GSE161382,data_availability,data availability,Complex download,,https://pmc.ncbi.nlm.nih.gov/articles/PMC10387117,,,,,,,,,Guided construction of single cell reference for human and mouse lung,,,,,,,
GSE171524,geo,https://www.ncbi.nlm.nih.gov/geo/query/acc.cgi?acc=GSE171524,data_availability,data availability,Complex download,,https://pmc.ncbi.nlm.nih.gov/articles/PMC10387117,,,,,,,,,Guided construction of single cell reference for human and mouse lung,,,,,,,
EGAS00001004082,ega-archive.org,https://ega-archive.org/studies/EGAS00001004082,data_availability,data availability,Contact to access,,https://pmc.ncbi.nlm.nih.gov/articles/PMC10387117,,,,,,,,,Guided construction of single cell reference for human and mouse lung,,,,,,,
syn21041850,synapse.org,https://www.synapse.org/Synapse:syn21041850,data_availability,data availability,Complex download or application to access,,https://pmc.ncbi.nlm.nih.gov/articles/PMC10387117,,,,,,,,,Guided construction of single cell reference for human and mouse lung,,,,,,,
LMEX0000004396,lungmap.net,n/a,data_availability,data availability,,,https://pmc.ncbi.nlm.nih.gov/articles/PMC10387117,,,,,,,,,Guided construction of single cell reference for human and mouse lung,,,,,,,
GSE122332,geo,https://www.ncbi.nlm.nih.gov/geo/query/acc.cgi?acc=GSE122332,data_availability,data availability,Complex download,,https://pmc.ncbi.nlm.nih.gov/articles/PMC10387117,,,,,,,,,Guided construction of single cell reference for human and mouse lung,,,,,,,
LMEX0000004397,lungmap.net,n/a,data_availability,data availability,,,https://pmc.ncbi.nlm.nih.gov/articles/PMC10387117,,,,,,,,,Guided construction of single cell reference for human and mouse lung,,,,,,,
GSE178362,geo,https://www.ncbi.nlm.nih.gov/geo/query/acc.cgi?acc=GSE178362,data_availability,data availability,Complex download,,https://pmc.ncbi.nlm.nih.gov/articles/PMC10387117,,,,,,,,,Guided construction of single cell reference for human and mouse lung,,,,,,,
GSE135851,geo,https://www.ncbi.nlm.nih.gov/geo/query/acc.cgi?acc=GSE135851,data_availability,data availability,Complex download,,https://pmc.ncbi.nlm.nih.gov/articles/PMC10387117,,,,,,,,,Guided construction of single cell reference for human and mouse lung,,,,,,,
GSE149563,geo,https://www.ncbi.nlm.nih.gov/geo/query/acc.cgi?acc=GSE149563,data_availability,data availability,Complex download,,https://pmc.ncbi.nlm.nih.gov/articles/PMC10387117,,,,,,,,,Guided construction of single cell reference for human and mouse lung,,,,,,,
dataset-427f1eee6dd44f50bae1ab13f0f3c6a9,beta.fastgenomics.org,n/a,data_availability,data availability,,,https://pmc.ncbi.nlm.nih.gov/articles/PMC10387117,,,,,,,,,Guided construction of single cell reference for human and mouse lung,,,,,,,
GSE136832,geo,https://www.ncbi.nlm.nih.gov/geo/query/acc.cgi?acc=GSE136832,data_availability,data availability,Complex download,,https://pmc.ncbi.nlm.nih.gov/articles/PMC10387117,,,,,,,,,Guided construction of single cell reference for human and mouse lung,,,,,,,
,,,supplementary material,.//supplementary-material,,41467_2023_40173_MOESM1_ESM.pdf,https://pmc.ncbi.nlm.nih.gov/articles/PMC10387117,https://pmc.ncbi.nlm.nih.gov/articles/instance/10387117/bin/41467_2023_40173_MOESM1_ESM.pdf,No Title,local-data,MOESM1,Supplementary Information,Supplementary  Information,"MNN outperforms RPCA and Harmony on both the UMAP inspection and cluster stability metrics measurement, we therefore set the mutual nearest neighbor (MNN) matching method in Monocle 3 as default, and Seurat’s reciprocal principal component analysis (RPCA) based integration and Harmony as alternatives (Supplementary Fig. 1 [this file] ). 
Cells with consistent cell type annotations were combined with the CellRef Seed to form the LungMAP Human Lung CellRef (347,970 cells) (Fig. 2B [rid=Fig2] , Supplementary Figs. 1 [this file] – 3 [this file] , “Methods”). 
Using the same approach, we constructed a cell type dictionary based on the LungMAP CellCards to define cell types in mouse lung during perinatal development, identified seed cells for each cell type (termed LungMAP Mouse Lung Development CellRef Seed”), and constructed a CellRef for mouse lung development (denoted as LungMAP Mouse Lung Development CellRef) using Drop-seq of mouse lungs ( = 95,658, 8 time points, 17 samples) from embryonic day 16.5 to postnatal day 28 (Fig. 3 [rid=Fig3] , Supplementary Fig. 4 [this file] , Supplementary Data 3 [rid=MOESM5] , 4 [rid=MOESM6] ). 
These tools provide highly interactive search, analyzing, and visualization functionalities for users to explore and reanalyze cell type and gene expression patterns provided by the LungMAP CellRefs (Fig. 4 [rid=Fig4] , Supplementary Fig. 6 [this file] ). Users can also select and highlight cells of interest (Supplementary Fig. 6 [this file] ). 
Evaluation of the other three test data samples were shown in Supplementary Fig. 7 [this file] . 
As shown in Fig. 5D–I [rid=Fig5] and Supplementary Fig. 7 [this file] , predicted cell types were well separated and formed clusters. Cell-type-specific marker genes from CellCards were selectively expressed in each predicted cell type, supporting the concordance of the cell identities (Fig. 5E, F [rid=Fig5] , Supplementary Fig. 7 [this file] ). The median values of all metrics are greater than 0.92 (Supplementary Fig. 8 [this file] ), supporting the high consistency of the automated CellRef cell type prediction with the original cell annotations. Both the LungMAP human and mouse lung CellRefs achieved high cross validation performance with ~0.92 median F1 and MCC scores for the human lung CellRef and 0.98 median F1 and MCC scores for the mouse lung CellRef, respectively (Supplementary Fig. 9 [this file] ). 
We summarized the one-to-one mapped cell types and the unique cell types/states in the Supplementary Fig. 10 [this file] . 
Similarly, when applying these stability metrics to CellRef and HLCA using their own data collections, CellRef produced slightly higher scores on SCCAF and TF-IDF; as well as a significantly higher score on cell re-assignment ( = 0.011) as compared to HLCA (Supplementary Fig. 11 [this file] ). scTriangulate leverages the computed stability scores to further assess the marginal importance of each annotation (CellRef and HLCA) using a cooperative game theory framework. scTriangulate predicted that 50% ( = 24/48) of the CellRef cell types to be of higher confidence (AEC, AF1, AF2, AM, ASMC, CD8 T, cDC1, cDC2, Ciliated, Goblet, Ionocyte, LEC, Platelet, pMON, Suprabasal, SVEC, VSMC), compared to 46% ( = 27/58) of the HCLA cell types (AT2, aCAP, Pericyte, Mesothelium, Peribronchial fibroblasts and Adventitial fibroblasts, etc.) (Fig. 8D [rid=Fig8] ). 
The overall distributions of iLISI scores in both CellRef and HLCA are not ideal, on average about 15% for CellRef, and 5% for HLCA, respectively (Supplementary Fig. 11 [this file] ), likely due to that both atlases were constructed using large collections of heterogeneous data from different biological regions and conditions rather than a well-designed balanced cohort. Nevertheless, CellRef consistently outperforms HLCA on the measurements of iLISI, and has the cLISI scores close to 1, indicating a well separation of the CellRef cell types (Supplementary Fig. 11 [this file] ). 
Results supported the high accuracy, cluster stability, and marker specificity of our mouse lung reference cell types (Supplementary Fig. 12 [this file] ; mean AUC 95.8, mean SCCAF score: 0.970, mean Reassign score: 0.881, mean TFID10 score: 0.892).",pdf,Guided construction of single cell reference for human and mouse lung,,,,,,,
,,,supplementary material,.//supplementary-material,,41467_2023_40173_MOESM2_ESM.pdf,https://pmc.ncbi.nlm.nih.gov/articles/PMC10387117,https://pmc.ncbi.nlm.nih.gov/articles/instance/10387117/bin/41467_2023_40173_MOESM2_ESM.pdf,No Title,local-data,MOESM2,Description of additional supplementary files,Description  of  additional  supplementary  files,,pdf,Guided construction of single cell reference for human and mouse lung,,,,,,,
,,,supplementary material,.//supplementary-material,,41467_2023_40173_MOESM3_ESM.xlsx,https://pmc.ncbi.nlm.nih.gov/articles/PMC10387117,https://pmc.ncbi.nlm.nih.gov/articles/instance/10387117/bin/41467_2023_40173_MOESM3_ESM.xlsx,No Title,local-data,MOESM3,Supplementary Data 1,Supplementary  Data  1,"This collection contains data from similar numbers of female and male donors ( = 48 and 55, respectively; 1 unannotated) (Fig. 1A [rid=Fig1] ; Supplementary Data 1 [this file] ). In total, 505,256 lung cells from 148 sc/snRNA-seq of normal human lung samples from 104 donors were used for LungMAP human lung CellRef construction (Supplementary Data 1 [this file] ).",xlsx,Guided construction of single cell reference for human and mouse lung,,,,,,,
,,,supplementary material,.//supplementary-material,,41467_2023_40173_MOESM4_ESM.xlsx,https://pmc.ncbi.nlm.nih.gov/articles/PMC10387117,https://pmc.ncbi.nlm.nih.gov/articles/instance/10387117/bin/41467_2023_40173_MOESM4_ESM.xlsx,No Title,local-data,MOESM4,Supplementary Data 2,Supplementary  Data  2,"Using this guided approach and a cell type dictionary derived from LungMAP CellCards (Supplementary Data 2 [this file] ), we identified 8,080 seed cells representing 48 normal human lung cell types, termed LungMAP Human Lung CellRef Seed (Fig. 2A [rid=Fig2] ). 
Evaluation of cell type annotations using CellRef cell type markers from Supplementary Data 2 [this file] . Percentages of cell type markers (Supplementary Data 2 [this file] ) that are differentially expressed in their corresponding cell type predictions ( = 34 cell types) in ( ). 
The human lung CellRef cell type selective markers were generated by including dictionary marker genes (Supplementary Data 2 [this file] ) and top selectively expressed markers for each cell type.",xlsx,Guided construction of single cell reference for human and mouse lung,,,,,,,
,,,supplementary material,.//supplementary-material,,41467_2023_40173_MOESM5_ESM.xlsx,https://pmc.ncbi.nlm.nih.gov/articles/PMC10387117,https://pmc.ncbi.nlm.nih.gov/articles/instance/10387117/bin/41467_2023_40173_MOESM5_ESM.xlsx,No Title,local-data,MOESM5,Supplementary Data 3,Supplementary  Data  3,"Using the same approach, we constructed a cell type dictionary based on the LungMAP CellCards to define cell types in mouse lung during perinatal development, identified seed cells for each cell type (termed LungMAP Mouse Lung Development CellRef Seed”), and constructed a CellRef for mouse lung development (denoted as LungMAP Mouse Lung Development CellRef) using Drop-seq of mouse lungs ( = 95,658, 8 time points, 17 samples) from embryonic day 16.5 to postnatal day 28 (Fig. 3 [rid=Fig3] , Supplementary Fig. 4 [rid=MOESM1] , Supplementary Data 3 [this file] , 4 [rid=MOESM6] ). 
In total, gene expression in 17 Drop-seq samples from eight time points (Supplementary Data 3 [this file] ) of mouse lung development were generated.",xlsx,Guided construction of single cell reference for human and mouse lung,,,,,,,
,,,supplementary material,.//supplementary-material,,41467_2023_40173_MOESM6_ESM.xlsx,https://pmc.ncbi.nlm.nih.gov/articles/PMC10387117,https://pmc.ncbi.nlm.nih.gov/articles/instance/10387117/bin/41467_2023_40173_MOESM6_ESM.xlsx,No Title,local-data,MOESM6,Supplementary Data 4,Supplementary  Data  4,"Using the same approach, we constructed a cell type dictionary based on the LungMAP CellCards to define cell types in mouse lung during perinatal development, identified seed cells for each cell type (termed LungMAP Mouse Lung Development CellRef Seed”), and constructed a CellRef for mouse lung development (denoted as LungMAP Mouse Lung Development CellRef) using Drop-seq of mouse lungs ( = 95,658, 8 time points, 17 samples) from embryonic day 16.5 to postnatal day 28 (Fig. 3 [rid=Fig3] , Supplementary Fig. 4 [rid=MOESM1] , Supplementary Data 3 [rid=MOESM5] , 4 [this file] ). In total, 40 mouse lung cell types have been identified with the guidance of the mouse lung cell type dictionary (Fig. 3 [rid=Fig3] , Supplementary Data 4 [this file] ). 
We constructed a cell type dictionary for mouse lung (Supplementary Data 4 [this file] ) based on our constructed dictionary derived from the LungMAP CellCards.",xlsx,Guided construction of single cell reference for human and mouse lung,,,,,,,
,,,supplementary material,.//supplementary-material,,41467_2023_40173_MOESM7_ESM.xlsx,https://pmc.ncbi.nlm.nih.gov/articles/PMC10387117,https://pmc.ncbi.nlm.nih.gov/articles/instance/10387117/bin/41467_2023_40173_MOESM7_ESM.xlsx,No Title,local-data,MOESM7,Supplementary Data 5,Supplementary  Data  5,"AUCs values for each of the mapped cell types ( = 42) in the CellRef (orange) and HLCA (blue) calculated using the cell type selective marker genes identified by CellRef (Supplementary Data 5 [this file] ). 
Next, we performed the same analysis using the cell type marker genes identified by CellRef (Supplementary Data 5 [this file] ). 
Top-ranked cell type specific DEGs (ranked by fold change in average expression) were combined with the known markers genes to form the CellRef cell type selective marker gene list (Supplementary Data 5 [this file] , up to 10 genes for each of the 48 CellRef human lung cell types).",xlsx,Guided construction of single cell reference for human and mouse lung,,,,,,,
,,,supplementary material,.//supplementary-material,,41467_2023_40173_MOESM8_ESM.xlsx,https://pmc.ncbi.nlm.nih.gov/articles/PMC10387117,https://pmc.ncbi.nlm.nih.gov/articles/instance/10387117/bin/41467_2023_40173_MOESM8_ESM.xlsx,No Title,local-data,MOESM8,Supplementary Data 6,Supplementary  Data  6,"Last, we evaluated the LungMAP mouse lung CellRef using the three stability metrics calculated by scTriangulate and the marker-based AUC analysis (“Methods” and Supplementary Data 6 [this file] ). 
Using the same approach, the mouse lung CellRef cell type selective marker genes were selected (Supplementary Data 6 [this file] , up to 10 marker genes per cell type) and used for the AUC based assessment of mouse lung CellRef.",xlsx,Guided construction of single cell reference for human and mouse lung,,,,,,,
,,,supplementary material,.//supplementary-material,,41467_2023_40173_MOESM9_ESM.pdf,https://pmc.ncbi.nlm.nih.gov/articles/PMC10387117,https://pmc.ncbi.nlm.nih.gov/articles/instance/10387117/bin/41467_2023_40173_MOESM9_ESM.pdf,No Title,local-data,MOESM9,Reporting Summary,Reporting  Summary,Further information on research design is available in the Nature Portfolio Reporting Summary [this file] linked to this article.,pdf,Guided construction of single cell reference for human and mouse lung,,,,,,,
syn1710680,synapse.org,https://www.synapse.org/Synapse:syn1710680,,,Complex download or application to access,,https://pmc.ncbi.nlm.nih.gov/articles/PMC4444046,,,,,,,,,Pan-Cancer Network Analysis Identifies Combinations of Rare Somatic Mutations across Pathways and Protein Complexes - PMC,,,,,,,
syn1729383,synapse.org,https://www.synapse.org/Synapse:syn1729383,,,Complex download or application to access,,https://pmc.ncbi.nlm.nih.gov/articles/PMC4444046,,,,,,,,,Pan-Cancer Network Analysis Identifies Combinations of Rare Somatic Mutations across Pathways and Protein Complexes - PMC,,,,,,,
syn1734155,synapse.org,https://www.synapse.org/Synapse:syn1734155,,,Complex download or application to access,,https://pmc.ncbi.nlm.nih.gov/articles/PMC4444046,,,,,,,,,Pan-Cancer Network Analysis Identifies Combinations of Rare Somatic Mutations across Pathways and Protein Complexes - PMC,,,,,,,
,,,n/a,,,https://doi.org/10.1038/ng.3168,https://pmc.ncbi.nlm.nih.gov/articles/PMC4444046,,10.1038/ng.3168,,,,n/a,,,Pan-Cancer Network Analysis Identifies Combinations of Rare Somatic Mutations across Pathways and Protein Complexes - PMC,n/a,pmc-layout__citation font-secondary font-xs,https://doi.org/10.1038/ng.3168,usa-link usa-link--external,click_feat_suppl,_blank,noopener noreferrer
