dataset_identifier,data_repository,dataset_webpage,citation_type,access_mode,link,source_url,download_link,title,content_type,id,caption,description,source_section,retrieval_pattern,context_description,file_extension,pub_title,raw_data_format,file_info,section_class,a_attr_href,a_attr_class,a_attr_data-ga-action,a_attr_target,a_attr_rel
,,,,,42003_2023_4791_MOESM19_ESM.pdf,https://pmc.ncbi.nlm.nih.gov/articles/PMC10185548,https://pmc.ncbi.nlm.nih.gov/articles/instance/10185548/bin/42003_2023_4791_MOESM19_ESM.pdf,No Title,local-data,MOESM19,Reporting summary,Reporting  summary,supplementary material,.//supplementary-material,Further information on research design is available in the Nature Portfolio Reporting Summary [this file] linked to this article.,pdf,Predictive network analysis identifies,XML,,,,,,,
syn26343262,synapse.org,https://www.synapse.org/[#!]*Synapse:syn26343262,n/a,Complex download or application to access,,https://pmc.ncbi.nlm.nih.gov/articles/PMC10353192,,,,,,,,,,,Dataset on infant mortality rates in Brazil - PMC,HTML,,,,,,,
syn47199836,synapse.org,https://www.synapse.org/[#!]*Synapse:syn47199836,n/a,Complex download or application to access,,https://pmc.ncbi.nlm.nih.gov/articles/PMC10353192,,,,,,,,,,,Dataset on infant mortality rates in Brazil - PMC,HTML,,,,,,,
syn47193617,synapse.org,https://www.synapse.org/[#!]*Synapse:syn47193617,n/a,Complex download or application to access,,https://pmc.ncbi.nlm.nih.gov/articles/PMC10353192,,,,,,,,,,,Dataset on infant mortality rates in Brazil - PMC,HTML,,,,,,,
syn47194116,synapse.org,https://www.synapse.org/[#!]*Synapse:syn47194116,n/a,Complex download or application to access,,https://pmc.ncbi.nlm.nih.gov/articles/PMC10353192,,,,,,,,,,,Dataset on infant mortality rates in Brazil - PMC,HTML,,,,,,,
syn47194124,synapse.org,https://www.synapse.org/[#!]*Synapse:syn47194124,n/a,Complex download or application to access,,https://pmc.ncbi.nlm.nih.gov/articles/PMC10353192,,,,,,,,,,,Dataset on infant mortality rates in Brazil - PMC,HTML,,,,,,,
syn47028493,synapse.org,https://www.synapse.org/[#!]*Synapse:syn47028493,n/a,Complex download or application to access,,https://pmc.ncbi.nlm.nih.gov/articles/PMC10353192,,,,,,,,,,,Dataset on infant mortality rates in Brazil - PMC,HTML,,,,,,,
syn47028485,synapse.org,https://www.synapse.org/[#!]*Synapse:syn47028485,n/a,Complex download or application to access,,https://pmc.ncbi.nlm.nih.gov/articles/PMC10353192,,,,,,,,,,,Dataset on infant mortality rates in Brazil - PMC,HTML,,,,,,,
syn47199024,synapse.org,https://www.synapse.org/[#!]*Synapse:syn47199024,n/a,Complex download or application to access,,https://pmc.ncbi.nlm.nih.gov/articles/PMC10353192,,,,,,,,,,,Dataset on infant mortality rates in Brazil - PMC,HTML,,,,,,,
,,,,,https://doi.org/10.1186/s13104-023-06425-9,https://pmc.ncbi.nlm.nih.gov/articles/PMC10353192,,10.1186/s13104-023-06425-9,,,,n/a,n/a,,,,Dataset on infant mortality rates in Brazil - PMC,HTML,n/a,pmc-layout__citation font-secondary font-xs,https://doi.org/10.1186/s13104-023-06425-9,usa-link usa-link--external,click_feat_suppl,_blank,noopener noreferrer
EGAS00001006034,ega-archive.org,https://ega-archive.org/studies/EGAS00001006034,n/a,Contact to access,,https://pmc.ncbi.nlm.nih.gov/articles/PMC9970873,,,,,,,,,,,The clinical utility of integrative genomics in childhood cancer extends beyond targetable mutations,XML,,,,,,,
EGAS00001006610,ega-archive.org,https://ega-archive.org/studies/EGAS00001006610,n/a,Contact to access,,https://pmc.ncbi.nlm.nih.gov/articles/PMC9970873,,,,,,,,,,,The clinical utility of integrative genomics in childhood cancer extends beyond targetable mutations,XML,,,,,,,
EGAS00001006642,ega-archive.org,https://ega-archive.org/studies/EGAS00001006642,n/a,Contact to access,,https://pmc.ncbi.nlm.nih.gov/articles/PMC9970873,,,,,,,,,,,The clinical utility of integrative genomics in childhood cancer extends beyond targetable mutations,XML,,,,,,,
syn11726602,synapse.org,https://www.synapse.org/[#!]*Synapse:syn11726602,n/a,Complex download or application to access,,https://pmc.ncbi.nlm.nih.gov/articles/PMC9970873,,,,,,,,,,,The clinical utility of integrative genomics in childhood cancer extends beyond targetable mutations,XML,,,,,,,
,,,,,43018_2022_474_MOESM1_ESM.pdf,https://pmc.ncbi.nlm.nih.gov/articles/PMC9970873,https://pmc.ncbi.nlm.nih.gov/articles/instance/9970873/bin/43018_2022_474_MOESM1_ESM.pdf,No Title,local-data,MOESM1,Reporting Summary,Reporting  Summary,supplementary material,.//supplementary-material,Further information on research design is available in the Nature Portfolio Reporting Summary [this file] linked to this article.,pdf,The clinical utility of integrative genomics in childhood cancer extends beyond targetable mutations,XML,,,,,,,
,,,,,43018_2022_474_MOESM2_ESM.xlsx,https://pmc.ncbi.nlm.nih.gov/articles/PMC9970873,https://pmc.ncbi.nlm.nih.gov/articles/instance/9970873/bin/43018_2022_474_MOESM2_ESM.xlsx,No Title,local-data,MOESM2,Supplementary Tables 1–15.,Supplementary  Tables  Supplementary  Tables  1–15.,supplementary material,.//supplementary-material,"Participant and tumor characteristics, as well as sample numbers, are outlined in Fig. 2a [rid=Fig2] , Extended Data Fig. 1 [rid=Fig7] and Supplementary Table 1 [this file] . Extended Data Fig. 2a [rid=Fig8] details the proportion of participants’ samples analyzed using each sequencing platform, and Supplementary Table 2 [this file] summarizes sample-level sequencing metrics. 
Please see Supplementary Table 1 [this file] for a full list of tumor types and acronyms, categories of actionable findings and additional demographic information. = 300 participants. 
In addition, our analysis was 100% concordant with standard clinical and cytogenetic testing for diagnostic/prognostic variants and fusions (for those with RNA available) in solid tumors, central nervous system (CNS) tumors and leukemias (Supplementary Table 3a [this file] ). For an additional nine participants, our analysis provided further characterization of previous clinical findings (Supplementary Table 3b [this file] ). Nine participants had sequencing findings that were of potential prognostic relevance (category B; Supplementary Table 4 [this file] ). 
Fifty-four percent of participants with tumor analysis ( = 143/264) had sequencing findings that were therapeutically targetable (category C; Figs. 2 [rid=Fig2] and 3a [rid=Fig3] and Supplementary Table 5 [this file] ); within subgroups, this corresponded to 72%, 58% and 46% of patients with a CNS tumor, solid tumor or leukemia/lymphoma, respectively. Thirty-seven (37/62, 60%) participants were treated with a matched targeted agent, 14 of 37 as part of a clinical trial (including one patient through a single-patient study), 15 of 37 through compassionate access, 7 of 37 through commercial access and 1 of 37 though an unknown mechanism (Supplementary Table 5 [this file] ). 
Variant details are depicted in Supplementary Table 5 [this file] . Please see Supplementary Table 1 [this file] for a full list of tumor types and acronyms , The proportion of COSMIC single-substitution signature 3 (BRCAness mutational signature) in the PCAWG dataset compared to KiCS cohort patients with absence or presence of either somatic or germline variants affecting the HR pathway. 
Previously unknown germline likely pathogenic or pathogenic (LP/P) variants in cancer predisposition genes (CPGs) were found in 15% ( = 46/300) of participants, resulting in referral for genetic counseling in 89% of cases and cascade testing and initiation of tumor surveillance for participants and/or their relatives in at least 67% and 37% of cases, respectively (9 participants had unknown surveillance status; Supplementary Table 6 [this file] ). 
Seven additional clinically actionable variants were identified upon retrospective analysis of somatic WGS data that were not detected by cancer panel or RNA-seq analysis (Supplementary Table 7 [this file] ). This WGS analysis was also fruitful (Supplementary Table 7 [this file] ) in detecting second hits in tumor-suppressor genes, demonstrating interesting mechanisms of tumor-suppressor inactivation and complex fusion events and highlighting a number of novel variants. 
In our cohort, nearly half of the germline LP/P variants in CPGs (21/46) occurred in genes involved in HRR ( , , , , , , , , , or ; Supplementary Table 6 [this file] ). Detailed analyses of KiCS HR somatic and KiCS HR germline cases are presented in Supplementary Table 8 [this file] . 
Nine percent of participants ( = 22 with 23 tumors) had hypermutant tumors, 9 with a TMB of 5–9.9 mutations per Mb, 7 with a TMB of 10–99.9 mutations per Mb and 6 with ultra-hypermutation (TMB of >100 mutations per Mb; Supplementary Table 9 [this file] ). Only 36% ( = 8) of patients with hypermutant tumors had LP/P germline variants in MMR genes ( = 3 heterozygous, = 1 compound heterozygous, = 4 homozygous; Supplementary Table 6 [this file] ), and one patient had somatic biallelic deleterious variants in MMR genes. 
Through detailed analysis of single-nucleotide variants (SNVs), insertions/deletions (indels) and copy number changes, we determined the proportion of patients with changes in tumor drivers (new drivers, expansion of driver clones, displacement/loss of driver clones or diminished driver clones; Supplementary Table 10 [this file] ). Of 38 patients, 22 showed emergence of a new driver and 9 showed loss of a driver; when considering the subset of these with therapeutic implications, 37% of patients ( = 14) had a change in therapy recommendation as a result of serial sample analysis (Fig. 6a [rid=Fig6] and Supplementary Table 10 [this file] ). 
Notably, our analysis also reliably captured every canonical fusion and other clinically relevant markers (for example, amplification in neuroblastoma), while providing further detailed characterization of clinical findings in other cases (Supplementary Table 3a,b [this file] ). 
Retrospective analysis of somatic WGS data in our cohort, using a filtering strategy designed to detect variants that would be overlooked by a panel, identified a small number of additional clinically actionable findings ( = 7; Supplementary Table 7 [this file] ). 
We also conducted a detailed analysis of changes to molecular drivers at the time of relapse (Fig. 6 [rid=Fig6] and Supplementary Table 10 [this file] ), which extends findings described in histology-specific cohorts and patient-derived xenograft models and so far has been shown in only very small patient subsets of a few broad precision medicine studies , with limited analysis. 
The sex and age of participants included in various analyses can be determined by referring to Supplementary Tables 1 [this file] and 2 [this file] . 
Tumors were sequenced using a custom pan-cancer DNA panel providing deep coverage for 864 cancer-associated genes (Supplementary Table 11 [this file] ) and with whole-transcriptome (RNA-seq) sequencing and WGS. Paired germline samples were analyzed by panel (with specific use of a CPG list for reporting; Supplementary Table 12 [this file] ) and WGS. 
The panel was designed to capture more than 15,000 exons from 864 genes (Supplementary Table 11 [this file] ) using Agilent SureSelect. 
This analysis included functional characterization of the variant by other published studies, RNA-seq of the patient’s tumor showing aberrant splicing or loss of expression, high TMB or mutational signatures detected in the tumor due to variants in MMR or HRD genes (Extended Data Fig. 9 [rid=Fig15] and Supplementary Table 12 [this file] ). 
Supplementary Table 13 [this file] shows the ability of WGS to detect variants using the panel as a truth set ( = 170 tumors). 
We analyzed the difference in TMB for 170 individual samples (Supplementary Table 14 [this file] ). 
A decision tree was used to filter/prioritize CNVs for actionable gene targets (Supplementary Table 15 [this file] ). 
Prioritization of genic variants from actionable genes (Supplementary Table 15 [this file] ) 
Samples were divided into ‘HR germline’ (germline variants affecting the HR pathway; = 20, 5 of which had multiple sequential samples) and ‘HR somatic’ (somatic HR variants; = 20; 5 of which had multiple samples) (Supplementary Table 8 [this file] ). 
Thirty-eight patients had multiple neoplasms of the same histology in the same individual (Supplementary Table 10 [this file] ). 
Please see Supplementary Table S1 [this file] for a full list of tumor types and acronyms. ( , Representative example of prior therapeutic exposures of sequenced samples (N = 232 tumor samples from 176 patients). ( Age distribution (N = 300 participants). ( Ethnicity distribution (based on self-reported ethnicity provided by 41% of study participants, N = 123 participants (59% missing data)).",xlsx,The clinical utility of integrative genomics in childhood cancer extends beyond targetable mutations,XML,,,,,,,
syn17009517,synapse.org,https://www.synapse.org/[#!]*Synapse:syn17009517,n/a,Complex download or application to access,,https://pmc.ncbi.nlm.nih.gov/articles/PMC7520714,,,,,,,,,,,Representing antibiotic relationships using measurements of efficacy against clinical isolates - PMC,html,,,,,,,
10.6084/m9.figshare.8159525.v1,doi.org,https://doi.org/10.6084/m9.figshare.8159525.v1,n/a,,,https://pmc.ncbi.nlm.nih.gov/articles/PMC7520714,,,,,,,,,,,Representing antibiotic relationships using measurements of efficacy against clinical isolates - PMC,html,,,,,,,
syn18344812,synapse.org,https://www.synapse.org/[#!]*Synapse:syn18344812,n/a,Complex download or application to access,,https://pmc.ncbi.nlm.nih.gov/articles/PMC7520714,,,,,,,,,,,Representing antibiotic relationships using measurements of efficacy against clinical isolates - PMC,html,,,,,,,
ATLAS,atlas-surveillance.com,n/a,n/a,,,https://pmc.ncbi.nlm.nih.gov/articles/PMC7520714,,,,,,,,,,,Representing antibiotic relationships using measurements of efficacy against clinical isolates - PMC,html,,,,,,,
,,,,,https://doi.org/10.12688/wellcomeopenres.15304.3,https://pmc.ncbi.nlm.nih.gov/articles/PMC7520714,,10.12688/wellcomeopenres.15304.3,,,,n/a,n/a,,,,Representing antibiotic relationships using measurements of efficacy against clinical isolates - PMC,html,n/a,pmc-layout__citation font-secondary font-xs,https://doi.org/10.12688/wellcomeopenres.15304.3,usa-link usa-link--external,click_feat_suppl,_blank,noopener noreferrer
